{
  "$schema": "https://json-schema.org/draft/2020-12/schema",
  "$id": "https://github.com/eman/ha_nwp500/docs/external-control-protocol-0.schema.json",
  "title": "NWP500 external control plan, protocol 0",
  "description": "A plan tells the integration's external control feature what state the heater should be in, and when. The feature programs it into the heater's reservation list. Top-level keys are attributes of the intent entity. Rules that span documents or depend on the device (superseded plans, bounds, allowed modes, the horizon and the entry budget) are checked by the feature and are listed in docs/external-control-spec.md.",
  "type": "object",
  "required": ["protocol", "intent_id", "issued_at", "segments"],
  "properties": {
    "protocol": {
      "type": "string",
      "pattern": "^0(\\.[0-9]+)?$",
      "description": "Protocol version. A major version the feature does not support rejects the document (unsupported_protocol)."
    },
    "intent_id": {
      "type": "string",
      "minLength": 1,
      "maxLength": 64,
      "description": "Unique per plan. The intent entity's state must change on every new plan; use this."
    },
    "issued_at": {
      "$ref": "#/$defs/timestamp",
      "description": "When the scheduler made the plan. An older document never replaces a newer one (superseded)."
    },
    "segments": {
      "type": "array",
      "description": "The timeline, in strictly increasing order of start. Each segment holds until the next segment's start; the last holds until a new plan. An empty list stops the plan: every programmed entry is withdrawn and the heater keeps its state.",
      "items": { "$ref": "#/$defs/segment" }
    },
    "grants": {
      "type": "array",
      "description": "Surplus grants: permission to raise the setpoint while surplus power is available and the compressor is already running.",
      "items": { "$ref": "#/$defs/grant" }
    }
  },
  "additionalProperties": true,
  "$defs": {
    "timestamp": {
      "type": "string",
      "format": "date-time",
      "pattern": "(Z|[+-][0-9]{2}:?[0-9]{2})$",
      "description": "ISO 8601 with a UTC offset. Naive timestamps are rejected. Truncated to the minute."
    },
    "mode_name": {
      "type": "string",
      "enum": ["heat_pump", "energy_saver", "high_demand", "electric"],
      "description": "vacation and power_off are never accepted. Entries are skipped during Vacation, so the next entry would never end it; an entry with the power-off mode is untested, and the mode command with that value switched the unit tested to Energy Saver (#160). Use setpoint \"min\" instead."
    },
    "segment": {
      "type": "object",
      "required": ["id", "start"],
      "properties": {
        "id": {
          "type": "string",
          "minLength": 1,
          "maxLength": 64,
          "description": "Unique in the document, across segments and grants."
        },
        "start": { "$ref": "#/$defs/timestamp" },
        "setpoint_f": { "type": "number" },
        "setpoint_c": { "type": "number" },
        "setpoint": {
          "const": "min",
          "description": "The lowest setpoint the feature will write (setpoint_min). Effectively off: it applies inside TOU windows, and the next segment's entry restores normal operation."
        },
        "mode": {
          "$ref": "#/$defs/mode_name",
          "description": "Required on the first segment. A later segment that omits it keeps the previous segment's mode."
        }
      },
      "oneOf": [
        { "required": ["setpoint_f"], "not": { "anyOf": [{ "required": ["setpoint_c"] }, { "required": ["setpoint"] }] } },
        { "required": ["setpoint_c"], "not": { "anyOf": [{ "required": ["setpoint_f"] }, { "required": ["setpoint"] }] } },
        { "required": ["setpoint"], "not": { "anyOf": [{ "required": ["setpoint_f"] }, { "required": ["setpoint_c"] }] } }
      ],
      "additionalProperties": true
    },
    "grant": {
      "type": "object",
      "required": ["id", "start", "end"],
      "properties": {
        "id": {
          "type": "string",
          "minLength": 1,
          "maxLength": 64,
          "description": "Unique in the document, across segments and grants."
        },
        "start": { "$ref": "#/$defs/timestamp" },
        "end": {
          "$ref": "#/$defs/timestamp",
          "description": "Must be later than start after truncation, or the grant alone is rejected (invalid_window)."
        },
        "max_f": { "type": "number" },
        "max_c": { "type": "number" }
      },
      "oneOf": [
        { "required": ["max_f"], "not": { "required": ["max_c"] } },
        { "required": ["max_c"], "not": { "required": ["max_f"] } }
      ],
      "additionalProperties": true
    }
  }
}
